OpenROAD 0a584d123190322b0725d5440c2c486d91d3afd8 
This program is licensed under the BSD-3 license. See the LICENSE file for details.
Components of this program may be licensed under more restrictive licenses which must be honored.
[INFO]: Reading ODB at '/project/openlane/runs/run_1/tmp/20-riscv_cpu.odb'…
define_corners Typical
read_liberty -corner Typical /build/pdk/sky130A/libs.ref/sky130_fd_sc_hd/lib/sky130_fd_sc_hd__tt_025C_1v80.lib
Using 1e-12 for capacitance...
Using 1e+03 for resistance...
Using 1e-09 for time...
Using 1e+00 for voltage...
Using 1e-03 for current...
Using 1e-09 for power...
Using 1e-06 for distance...
Reading design constraints file at '/openlane/scripts/base.sdc'…
[INFO]: Setting output delay to: 4.0
[INFO]: Setting input delay to: 4.0
[INFO]: Setting load to: 0.033442
[INFO]: Setting clock uncertainty to: 0.25
[INFO]: Setting clock transition to: 0.15
[INFO]: Setting timing derate to: 5.0 %
[INFO]: Setting signal min routing layer to: met1 and clock min routing layer to met3. 
[INFO]: Setting signal max routing layer to: met5 and clock max routing layer to met5. 
-congestion_iterations 50 -verbose -congestion_report_file /project/openlane/runs/run_1/tmp/routing/groute-congestion.rpt
[INFO GRT-0020] Min routing layer: met1
[INFO GRT-0021] Max routing layer: met5
[INFO GRT-0022] Global adjustment: 30%
[INFO GRT-0023] Grid origin: (0, 0)
[INFO GRT-0043] No OR_DEFAULT vias defined.
[INFO GRT-0088] Layer li1     Track-Pitch = 0.4600  line-2-Via Pitch: 0.3400
[INFO GRT-0088] Layer met1    Track-Pitch = 0.3400  line-2-Via Pitch: 0.3400
[INFO GRT-0088] Layer met2    Track-Pitch = 0.4600  line-2-Via Pitch: 0.3500
[INFO GRT-0088] Layer met3    Track-Pitch = 0.6800  line-2-Via Pitch: 0.6150
[INFO GRT-0088] Layer met4    Track-Pitch = 0.9200  line-2-Via Pitch: 1.0400
[INFO GRT-0088] Layer met5    Track-Pitch = 3.4000  line-2-Via Pitch: 3.1100
[INFO GRT-0019] Found 208 clock nets.
[INFO GRT-0001] Minimum degree: 2
[INFO GRT-0002] Maximum degree: 19
[INFO GRT-0003] Macros: 0
[INFO GRT-0004] Blockages: 30889

[INFO GRT-0053] Routing resources analysis:
          Routing      Original      Derated      Resource
Layer     Direction    Resources     Resources    Reduction (%)
---------------------------------------------------------------
li1        Vertical            0             0          0.00%
met1       Horizontal     943516        463191          50.91%
met2       Vertical       707420        468673          33.75%
met3       Horizontal     471758        327084          30.67%
met4       Vertical       283402        180646          36.26%
met5       Horizontal      94178         45144          52.07%
---------------------------------------------------------------

[INFO GRT-0101] Running extra iterations to remove overflow.
[INFO GRT-0197] Via related to pin nodes: 47320
[INFO GRT-0198] Via related Steiner nodes: 2821
[INFO GRT-0199] Via filling finished.
[INFO GRT-0111] Final number of vias: 57631
[INFO GRT-0112] Final usage 3D: 277257

[INFO GRT-0096] Final congestion report:
Layer         Resource        Demand        Usage (%)    Max H / Max V / Total Overflow
---------------------------------------------------------------------------------------
li1                  0             0            0.00%             0 /  0 /  0
met1            463191         39447            8.52%             0 /  0 /  0
met2            468673         45682            9.75%             0 /  0 /  0
met3            327084         12466            3.81%             0 /  0 /  0
met4            180646          6690            3.70%             0 /  0 /  0
met5             45144            79            0.17%             0 /  0 /  0
---------------------------------------------------------------------------------------
Total          1484738        104364            7.03%             0 /  0 /  0

[INFO GRT-0018] Total wirelength: 930810 um
[INFO GRT-0014] Routed nets: 9405
[INFO GRT-0006] Repairing antennas, iteration 1.
[INFO GRT-0043] No OR_DEFAULT vias defined.
[WARNING ANT-0009] Net net51 requires more than 10 diodes per gate to repair violations.
[INFO GRT-0012] Found 137 antenna violations.
[INFO GRT-0015] Inserted 217 diodes.
[INFO GRT-0054] Using detailed placer to place 1 diodes.
[INFO GRT-0009] rerouting 7708 nets.
[INFO GRT-0001] Minimum degree: 2
[INFO GRT-0002] Maximum degree: 19
[INFO GRT-0006] Repairing antennas, iteration 2.
[INFO GRT-0043] No OR_DEFAULT vias defined.
[INFO GRT-0012] Found 74 antenna violations.
[INFO GRT-0015] Inserted 101 diodes.
[INFO GRT-0054] Using detailed placer to place 8 diodes.
[INFO GRT-0009] rerouting 555 nets.
[INFO GRT-0001] Minimum degree: 2
[INFO GRT-0002] Maximum degree: 17
[INFO GRT-0006] Repairing antennas, iteration 3.
[INFO GRT-0043] No OR_DEFAULT vias defined.
[INFO GRT-0012] Found 19 antenna violations.
[INFO GRT-0015] Inserted 27 diodes.
[INFO GRT-0009] rerouting 82 nets.
[INFO GRT-0001] Minimum degree: 2
[INFO GRT-0002] Maximum degree: 15
[INFO GRT-0006] Repairing antennas, iteration 4.
[INFO GRT-0043] No OR_DEFAULT vias defined.
[INFO GRT-0012] Found 7 antenna violations.
[INFO GRT-0015] Inserted 9 diodes.
[INFO GRT-0009] rerouting 8 nets.
[INFO GRT-0001] Minimum degree: 10
[INFO GRT-0002] Maximum degree: 17
[INFO GRT-0006] Repairing antennas, iteration 5.
[INFO GRT-0043] No OR_DEFAULT vias defined.
[INFO GRT-0012] Found 3 antenna violations.
[INFO GRT-0015] Inserted 3 diodes.
[INFO GRT-0009] rerouting 4 nets.
[INFO GRT-0001] Minimum degree: 15
[INFO GRT-0002] Maximum degree: 18
[INFO GRT-0006] Repairing antennas, iteration 6.
[INFO GRT-0043] No OR_DEFAULT vias defined.
[INFO GRT-0012] Found 1 antenna violations.
[INFO GRT-0015] Inserted 1 diodes.
[INFO GRT-0009] rerouting 2 nets.
[INFO GRT-0001] Minimum degree: 17
[INFO GRT-0002] Maximum degree: 17
[INFO GRT-0006] Repairing antennas, iteration 7.
[INFO GRT-0043] No OR_DEFAULT vias defined.
[INFO GRT-0012] Found 1 antenna violations.
[INFO GRT-0015] Inserted 1 diodes.
[INFO GRT-0009] rerouting 1 nets.
[INFO GRT-0001] Minimum degree: 18
[INFO GRT-0002] Maximum degree: 18
[INFO GRT-0006] Repairing antennas, iteration 8.
[INFO GRT-0043] No OR_DEFAULT vias defined.
[INFO GRT-0012] Found 0 antenna violations.
Placement Analysis
---------------------------------
total displacement          0.0 u
average displacement        0.0 u
max displacement            0.0 u
original HPWL          610234.9 u
legalized HPWL         610234.9 u
delta HPWL                    0 %

[INFO DPL-0020] Mirrored 4466 instances
[INFO DPL-0021] HPWL before          610234.9 u
[INFO DPL-0022] HPWL after           597112.2 u
[INFO DPL-0023] HPWL delta               -2.2 %
[INFO]: Setting signal min routing layer to: met1 and clock min routing layer to met3. 
[INFO]: Setting signal max routing layer to: met5 and clock max routing layer to met5. 
-congestion_iterations 50 -verbose -congestion_report_file /project/openlane/runs/run_1/tmp/routing/groute-congestion.rpt
[INFO GRT-0020] Min routing layer: met1
[INFO GRT-0021] Max routing layer: met5
[INFO GRT-0022] Global adjustment: 30%
[INFO GRT-0023] Grid origin: (0, 0)
[INFO GRT-0043] No OR_DEFAULT vias defined.
[INFO GRT-0088] Layer li1     Track-Pitch = 0.4600  line-2-Via Pitch: 0.3400
[INFO GRT-0088] Layer met1    Track-Pitch = 0.3400  line-2-Via Pitch: 0.3400
[INFO GRT-0088] Layer met2    Track-Pitch = 0.4600  line-2-Via Pitch: 0.3500
[INFO GRT-0088] Layer met3    Track-Pitch = 0.6800  line-2-Via Pitch: 0.6150
[INFO GRT-0088] Layer met4    Track-Pitch = 0.9200  line-2-Via Pitch: 1.0400
[INFO GRT-0088] Layer met5    Track-Pitch = 3.4000  line-2-Via Pitch: 3.1100
[INFO GRT-0019] Found 208 clock nets.
[INFO GRT-0001] Minimum degree: 2
[INFO GRT-0002] Maximum degree: 19
[INFO GRT-0003] Macros: 0
[INFO GRT-0004] Blockages: 30889

[INFO GRT-0053] Routing resources analysis:
          Routing      Original      Derated      Resource
Layer     Direction    Resources     Resources    Reduction (%)
---------------------------------------------------------------
li1        Vertical            0             0          0.00%
met1       Horizontal     943516        463191          50.91%
met2       Vertical       707420        468673          33.75%
met3       Horizontal     471758        327084          30.67%
met4       Vertical       283402        180646          36.26%
met5       Horizontal      94178         45144          52.07%
---------------------------------------------------------------

[INFO GRT-0101] Running extra iterations to remove overflow.
[INFO GRT-0197] Via related to pin nodes: 47672
[INFO GRT-0198] Via related Steiner nodes: 2784
[INFO GRT-0199] Via filling finished.
[INFO GRT-0111] Final number of vias: 57920
[INFO GRT-0112] Final usage 3D: 278249

[INFO GRT-0096] Final congestion report:
Layer         Resource        Demand        Usage (%)    Max H / Max V / Total Overflow
---------------------------------------------------------------------------------------
li1                  0             0            0.00%             0 /  0 /  0
met1            463191         39740            8.58%             0 /  0 /  0
met2            468673         45480            9.70%             0 /  0 /  0
met3            327084         12219            3.74%             0 /  0 /  0
met4            180646          6971            3.86%             0 /  0 /  0
met5             45144            79            0.17%             0 /  0 /  0
---------------------------------------------------------------------------------------
Total          1484738        104489            7.04%             0 /  0 /  0

[INFO GRT-0018] Total wirelength: 932790 um
[INFO GRT-0014] Routed nets: 9405
Setting global connections for newly added cells…
Writing OpenROAD database to '/project/openlane/runs/run_1/tmp/routing/22-global.odb'…
Writing layout to '/project/openlane/runs/run_1/tmp/routing/22-global.def'…
Writing routing guides to '/project/openlane/runs/run_1/tmp/routing/22-global.guide'…
